{
    "$schema": "http://json-schema.org/draft-07/schema#",
    "title": "HexMarksTheSpot Parser Configuration",
    "description": "JSON schema for defining file format parsers in HexMarksTheSpot",
    "type": "object",
    "required": ["name", "fields"],
    "properties": {
        "name": {
            "type": "string",
            "description": "Name of the file format"
        },
        "description": {
            "type": "string",
            "description": "Description of the file format"
        },
        "magic_bytes": {
            "type": "string",
            "description": "Hex string of magic bytes (e.g., '504B0304' for ZIP)",
            "pattern": "^[0-9A-Fa-f]+$"
        },
        "magic_offset": {
            "type": "integer",
            "description": "Offset where magic bytes appear",
            "default": 0,
            "minimum": 0
        },
        "endianness": {
            "type": "string",
            "description": "Default byte order for multi-byte values",
            "enum": ["little", "big"],
            "default": "little"
        },
        "version": {
            "type": "string",
            "description": "Parser version"
        },
        "author": {
            "type": "string",
            "description": "Parser author"
        },
        "references": {
            "type": "array",
            "description": "URLs to format documentation",
            "items": {
                "type": "string",
                "format": "uri"
            }
        },
        "file_extensions": {
            "type": "array",
            "description": "File extensions this parser handles (e.g., [\".lnk\", \".png\"]). Used for extension-based parser matching (highest priority).",
            "items": {
                "type": "string",
                "pattern": "^\\."
            }
        },
        "alternative_magic": {
            "type": "array",
            "description": "Alternative magic byte sequences for variant formats (lowest priority matching).",
            "items": {
                "type": "object",
                "required": ["bytes"],
                "properties": {
                    "bytes": {
                        "type": "string",
                        "description": "Hex string of alternative magic bytes",
                        "pattern": "^[0-9A-Fa-f]+$"
                    },
                    "offset": {
                        "type": "integer",
                        "description": "Offset where these magic bytes appear",
                        "default": 0,
                        "minimum": 0
                    }
                }
            }
        },
        "fields": {
            "type": "array",
            "description": "Array of field definitions",
            "items": {
                "$ref": "#/definitions/field"
            }
        }
    },
    "definitions": {
        "field": {
            "type": "object",
            "required": ["name"],
            "properties": {
                "name": {
                    "type": "string",
                    "description": "Field name (used as identifier)"
                },
                "size": {
                    "oneOf": [
                        {
                            "type": "integer",
                            "minimum": 0
                        },
                        {
                            "type": "string",
                            "description": "Dynamic size reference (e.g., '$data_length')"
                        }
                    ],
                    "description": "Size in bytes or reference to another field (not required for struct/section types)"
                },
                "type": {
                    "type": "string",
                    "description": "Field type",
                    "enum": [
                        "bytes",
                        "uint",
                        "int",
                        "string",
                        "utf16",
                        "utf16le",
                        "utf16be",
                        "guid",
                        "filetime",
                        "unix_time",
                        "unix_time_64",
                        "bitfield",
                        "skip",
                        "remaining",
                        "vlq",
                        "struct",
                        "section"
                    ],
                    "default": "bytes"
                },
                "fields": {
                    "type": "array",
                    "description": "Nested fields (for struct and section types)",
                    "items": {
                        "$ref": "#/definitions/field"
                    }
                },
                "description": {
                    "type": "string",
                    "description": "Human-readable description of the field"
                },
                "endianness": {
                    "type": "string",
                    "description": "Override endianness for this field",
                    "enum": ["little", "big"]
                },
                "color": {
                    "type": "string",
                    "description": "Hex color code for highlighting (e.g., '#FF0000')",
                    "pattern": "^#[0-9A-Fa-f]{6}$"
                },
                "forensic_value": {
                    "oneOf": [
                        {
                            "type": "boolean",
                            "description": "Mark as forensically important with default red highlighting"
                        },
                        {
                            "type": "string",
                            "description": "Forensic category for specialized highlighting",
                            "enum": ["critical", "important", "timestamp", "identifier", "path", "network"]
                        }
                    ],
                    "description": "Mark as forensically important. Use true for default red, or a category: 'critical' (red), 'important' (amber), 'timestamp' (purple), 'identifier' (pink for GUIDs/MACs/serials), 'path' (cyan for file paths), 'network' (deep orange for network data)",
                    "default": false
                },
                "informational": {
                    "type": "boolean",
                    "description": "Mark field as informational (green/teal highlighting). For descriptive metadata fields that provide context but are not forensically critical. Forensic_value takes precedence if both are set.",
                    "default": false
                },
                "value_map": {
                    "type": "object",
                    "description": "Map integer values to descriptions",
                    "additionalProperties": {
                        "type": "string"
                    }
                },
                "bit_flags": {
                    "type": "object",
                    "description": "For bitfield type - map bit positions to names or detailed descriptions",
                    "additionalProperties": {
                        "oneOf": [
                            {
                                "type": "string"
                            },
                            {
                                "type": "object",
                                "properties": {
                                    "name": {
                                        "type": "string",
                                        "description": "Flag name"
                                    },
                                    "description": {
                                        "type": "string",
                                        "description": "Detailed flag description (supports markdown)"
                                    }
                                },
                                "required": ["name"]
                            }
                        ]
                    }
                },
                "condition": {
                    "type": "string",
                    "description": "Conditional expression using Python syntax (e.g., '$flags & 0x01', '$value == 5 or $value == 2')"
                },
                "enabled": {
                    "type": "boolean",
                    "description": "Set to false to skip this field during parsing. Useful for structures that exist in separate files (e.g., WAL, journal) or are not yet needed.",
                    "default": true
                },
                "repeat": {
                    "oneOf": [
                        {
                            "type": "integer",
                            "minimum": 0,
                            "description": "Fixed number of repetitions"
                        },
                        {
                            "type": "string",
                            "description": "Dynamic count reference (e.g., '$DatabaseSizeInPages', '$PageCount - 1'), 'eof' to repeat until end of file, or 'until' to repeat until repeat_until condition is met"
                        }
                    ],
                    "description": "Repeat a struct/section N times, by field reference, until EOF, or until a condition is met. Only valid on struct/section types. Each iteration is named Name[0], Name[1], etc."
                },
                "repeat_until": {
                    "type": "string",
                    "description": "Condition expression evaluated after each repeat iteration. When it evaluates to true, the repeat loop stops. Typically used with repeat: 'until'. Example: '$ItemIDSize == 0' to stop when a size field is zero."
                },
                "repeat_step": {
                    "oneOf": [
                        {
                            "type": "integer",
                            "minimum": 1,
                            "description": "Fixed byte size per iteration"
                        },
                        {
                            "type": "string",
                            "description": "Dynamic step size reference (e.g., '$PageSize')"
                        }
                    ],
                    "description": "Fixed byte stride per repeat iteration. Ensures each iteration starts exactly this many bytes after the previous, regardless of how many bytes inner fields consume. Useful for page-aligned structures."
                },
                "expected_values": {
                    "oneOf": [
                        {
                            "type": "array",
                            "description": "List of valid values. Parser logs a warning if parsed value is not in this list.",
                            "items": {
                                "oneOf": [
                                    { "type": "integer" },
                                    { "type": "string" }
                                ]
                            }
                        },
                        {
                            "type": "object",
                            "description": "Range constraint with optional min/max",
                            "properties": {
                                "min": { "type": "integer", "description": "Minimum allowed value (inclusive)" },
                                "max": { "type": "integer", "description": "Maximum allowed value (inclusive)" }
                            }
                        }
                    ],
                    "description": "Expected value constraint. If an array: parsed value must be one of the listed values. If an object with min/max: parsed value must be within range. Mismatches are logged as warnings with offset and raw hex for forensic triage."
                },
                "color_gradient": {
                    "type": "boolean",
                    "description": "When true on a struct/section, children inherit the parent's base color with progressively brighter tones. Creates a visual gradient indicating related fields belonging to the same logical group.",
                    "default": false
                },
                "deprecated": {
                    "oneOf": [
                        { "type": "boolean" },
                        { "type": "string" }
                    ],
                    "description": "Marks a field as deprecated. Unlike 'enabled: false' (which skips the field entirely), deprecated fields are still parsed and displayed but shown in a muted gray color with a deprecation notice in the description. Set to true for a generic notice, or provide a string explaining the deprecation reason or migration path.",
                    "default": false
                },
                "output_format": {
                    "type": "string",
                    "description": "Controls how the parsed value is displayed in the Value column and Description pane. Overrides the default display derived from the field type. Available formats:\n- 'hex': Hexadecimal (0xFF)\n- 'decimal': Decimal integer\n- 'ascii': ASCII string representation\n- 'base64': Base64-encoded\n- 'binary': Binary bit string (0b...)\n- 'datetime_filetime': Windows FILETIME (100ns intervals since 1601-01-01)\n- 'datetime_unix': Unix epoch (seconds since 1970-01-01)\n- 'datetime_unix_ms': Unix epoch milliseconds\n- 'datetime_dos': DOS/FAT date-time (4 bytes: 2-byte time + 2-byte date)\n- 'ip4': IPv4 address (4 bytes)\n- 'ip6': IPv6 address (16 bytes)\n- 'size_bytes': Human-readable file size (KB/MB/GB)\n- 'bool': Boolean (0=False, non-zero=True)",
                    "enum": [
                        "hex",
                        "decimal",
                        "ascii",
                        "base64",
                        "binary",
                        "datetime_filetime",
                        "datetime_unix",
                        "datetime_unix_ms",
                        "datetime_dos",
                        "ip4",
                        "ip6",
                        "size_bytes",
                        "bool"
                    ]
                }
            }
        }
    }
}
